{
  "artifact_kind": "urnapack_execution",
  "command": [
    "fetch",
    "--manifest",
    "origin-v2-good.json"
  ],
  "elapsed_ms": 1000,
  "errors": [],
  "finished_at": "2026-10-28T00:00:01+00:00",
  "format_version": 1,
  "inputs": [
    {
      "path": "origin-v2-good.json",
      "sha256": "ab6771af19d771c0b3ee46683483ad3f5f94e7003b1e03842d0124c86b5396d4"
    }
  ],
  "outputs": [
    {
      "path": "origem-v2.bin",
      "sha256": "afeb17092d56e526465ad1c3d29c2b9c65261b59c03f50cee6a7279aa882428c",
      "size_bytes": 30
    }
  ],
  "params": {
    "manifest": "origin-v2-good.json"
  },
  "started_at": "2026-10-28T00:00:00+00:00",
  "success": true,
  "tool": "fetch-source-v1"
}
